Keyword	Avg Monthly Volume	Competition	CPC Low	CPC High	YoY Change	Intent	Silo Assignment	Source Batch
permanent outdoor lights holiday	50	Unknown			0%	T	Holiday Lighting	Batch 3 - New Commercial
permanent outdoor lights led	50	Unknown			0%	T	Permanent Lighting	Batch 3 - New Commercial
permanent outdoor lights smart rgbic outdoor lights	50	Unknown			0%	T	Permanent Lighting	Batch 3 - New Commercial
permanent outdoor soffit lights	50	High			∞	T	Permanent Lighting	Batch 3 - New Commercial
permanent rgbic outdoor lights	50	Unknown			0%	T	Permanent Lighting	Batch 3 - New Commercial
permanent solar lights	50	Unknown			0%	T	Permanent Lighting	Batch 3 - New Commercial
professional dryer vent cleaning company	50	Unknown			0%	T	Dryer Vent Cleaning	Batch 3 - New Commercial
smart permanent outdoor lights	50	Unknown			0%	T	Permanent Lighting	Batch 3 - New Commercial
the govee outdoor permanent lights	50	Unknown			0%	N	Permanent Lighting	Batch 3 - New Commercial
soft washing near me	50	Low			0%	T/L	Soft Washing	Batch 4 - Head Terms
roof cleaning near me	50	Low	3.22	15.56	900%	T/L	Roof Cleaning	Batch 4 - Head Terms
parking lot maintenance	50	Low			0%	T	Parking Lot Services	Batch 4 - Head Terms
commercial pressure washing	50	High	0.82	2.93	0%	T	Industrial	Batch 4 - Head Terms
fleet washing near me	50	Unknown			-100%	T/L	Fleet Washing	Batch 4 - Head Terms
construction cleanup near me	50	Unknown			0%	T/L	Construction Cleanup	Batch 4 - Head Terms
house washing near me	50	Low	1.70	7.61	900%	T/L	Soft Washing	Batch 4 - Head Terms
house power washing near me	50	Medium	0.71	5.16	0%	T/L	Pressure Washing	Batch 4 - Head Terms
$99 gutter cleaning near me	50	Unknown			-100%	T/L	Gutter Services	Batch 4 - Head Terms
gutter cleaning services near me	50	Low			0%	T/L	Gutter Services	Batch 4 - Head Terms
power washing services near me	50	Medium	3.17	7.25	0%	T/L	Pressure Washing	Batch 4 - Head Terms
gutter guys near me	50	High			∞	T/L	Gutter Services	Batch 4 - Head Terms
pressure washing companies near me	50	Low	2.10	12.09	0%	T/L	Pressure Washing	Batch 4 - Head Terms
home power washing near me	50	Unknown			-100%	T/L	Pressure Washing	Batch 4 - Head Terms
roof cleaning services near me	50	Medium			0%	T/L	Roof Cleaning	Batch 4 - Head Terms
driveway cleaning near me	50	Low			0%	T/L	Concrete Cleaning	Batch 4 - Head Terms
gutter cleaners in my area	50	High			0%	T	Gutter Services	Batch 4 - Head Terms
window cleaning services near me	50	Medium	1.55	3.94	0%	T/L	Window Cleaning	Batch 4 - Head Terms
commercial power washer	50	High	0.74	12.30	0%	T	Industrial	Batch 4 - Head Terms
power wash house cost	50	Low	1.00	4.06	0%	T	Pressure Washing	Batch 4 - Head Terms
cheap gutter cleaning near me	50	Unknown			0%	T/L	Gutter Services	Batch 4 - Head Terms
gutter cleaning near me prices	50	Unknown			-100%	C	Gutter Services	Batch 4 - Head Terms
home pressure washing near me	50	Medium	0.71	5.16	0%	T/L	Pressure Washing	Batch 4 - Head Terms
best gutter cleaning near me	50	Unknown			0%	T/L	Gutter Services	Batch 4 - Head Terms
gutter cleaning prices near me	50	High			0%	C	Gutter Services	Batch 4 - Head Terms
roof and gutter cleaning near me	50	Unknown			0%	T/L	Roof Cleaning	Batch 4 - Head Terms
powerwasher near me	50	Medium			0%	T/L		Batch 4 - Head Terms
fish window cleaning near me	50	Low			0%	T/L	Window Cleaning	Batch 4 - Head Terms
window cleaners in my area	50	Medium			0%	T	Window Cleaning	Batch 4 - Head Terms
parking lot repair near me	50	Medium	4.04	16.63	∞	T/L	Parking Lot Services	Batch 4 - Head Terms
house washing services near me	50	High			∞	T/L	Soft Washing	Batch 4 - Head Terms
professional pressure washer	50	Medium			0%	T	Pressure Washing	Batch 4 - Head Terms
power washing near me prices	50	Low			∞	C	Pressure Washing	Batch 4 - Head Terms
local window cleaners	50	High			0%	T	Window Cleaning	Batch 4 - Head Terms
parking lot repair	50	Medium			∞	T	Parking Lot Services	Batch 4 - Head Terms
house pressure washing near me	50	Medium	0.71	5.16	0%	T/L	Pressure Washing	Batch 4 - Head Terms
deck power washing near me	50	Low			0%	T/L	Pressure Washing	Batch 4 - Head Terms
gutter cleaning companies near me	50	High			0%	T/L	Gutter Services	Batch 4 - Head Terms
gutter maintenance near me	50	Unknown			0%	T/L	Gutter Services	Batch 4 - Head Terms
local gutter cleaners	50	Unknown			0%	T	Gutter Services	Batch 4 - Head Terms
metal roof cleaning near me	50	Medium			0%	T/L	Roof Cleaning	Batch 4 - Head Terms
roof washing near me	50	High	1.33	12.73	0%	T/L	Roof Cleaning	Batch 4 - Head Terms
tile roof cleaning near me	50	Unknown			-100%	T/L	Roof Cleaning	Batch 4 - Head Terms
exterior house washing near me	50	Low			0%	T/L	Soft Washing	Batch 4 - Head Terms
siding cleaning near me	50	Unknown			-100%	T/L		Batch 4 - Head Terms
residential window cleaning near me	50	High			0%	T/L	Window Cleaning	Batch 4 - Head Terms
window cleaning company near me	50	Medium			0%	T/L	Window Cleaning	Batch 4 - Head Terms
exterior house cleaning near me	50	High			0%	T/L		Batch 4 - Head Terms
same day gutter cleaning near me	50	Unknown			0%	T/L	Gutter Services	Batch 4 - Head Terms
driveway power washing near me	50	High			∞	T/L	Pressure Washing	Batch 4 - Head Terms
mobile pressure washing near me	50	Low			0%	T/L	Pressure Washing	Batch 4 - Head Terms
gutter cleaning cost near me	50	Medium			0%	C	Gutter Services	Batch 4 - Head Terms
pressure wash house near me	50	Low			0%	T/L	Pressure Washing	Batch 4 - Head Terms
roof gutter cleaning near me	50	Unknown			0%	T/L	Roof Cleaning	Batch 4 - Head Terms
professional power washer	50	Medium			0%	T	Pressure Washing	Batch 4 - Head Terms
gutter and roof cleaning near me	50	Unknown			0%	T/L	Roof Cleaning	Batch 4 - Head Terms
best commercial pressure washer	50	High	0.57	1.90	0%	I	Industrial	Batch 4 - Head Terms
window cleaners near me prices	50	Unknown			0%	C	Window Cleaning	Batch 4 - Head Terms
pressure washing near me prices	50	Unknown			0%	C	Pressure Washing	Batch 4 - Head Terms
driveway pressure washing near me	50	Low			0%	T/L	Pressure Washing	Batch 4 - Head Terms
roof cleaning companies near me	50	Medium			0%	T/L	Roof Cleaning	Batch 4 - Head Terms
clean my gutters near me	50	Unknown			0%	T/L	Gutter Services	Batch 4 - Head Terms
roof pressure cleaning near me	50	Medium			∞	T/L	Pressure Washing	Batch 4 - Head Terms
pressure washer nearby	50	High			0%	T	Pressure Washing	Batch 4 - Head Terms
best roof cleaning services near me	50	Unknown			0%	T/L	Roof Cleaning	Batch 4 - Head Terms
window washing services near me	50	Medium	1.55	3.94	0%	T/L	Window Cleaning	Batch 4 - Head Terms
exterior pressure washing near me	50	Unknown			0%	T/L	Pressure Washing	Batch 4 - Head Terms
window washers near me residential	50	Medium			∞	T/L	Window Cleaning	Batch 4 - Head Terms
local power washing companies	50	Medium			∞	T	Pressure Washing	Batch 4 - Head Terms
commercial window cleaning near me	50	Low			0%	T/L	Window Cleaning	Batch 4 - Head Terms
soft power washing near me	50	Unknown			0%	T/L	Pressure Washing	Batch 4 - Head Terms
guttering services near me	50	High	5.96	58.55	0%	T/L	Gutter Services	Batch 4 - Head Terms
house pressure washing services near me	50	Unknown			-100%	T/L	Pressure Washing	Batch 4 - Head Terms
gutter clean out near me	50	High			∞	T/L	Gutter Services	Batch 4 - Head Terms
window cleaning prices near me	50	High			0%	C	Window Cleaning	Batch 4 - Head Terms
construction cleaning services near me	50	Unknown			-100%	T/L	Construction Cleanup	Batch 4 - Head Terms
roof cleaners in my area	50	Unknown			0%	T	Roof Cleaning	Batch 4 - Head Terms
window washers near me prices	50	Unknown			-100%	C	Window Cleaning	Batch 4 - Head Terms
soft pressure washing near me	50	Unknown			0%	T/L	Pressure Washing	Batch 4 - Head Terms
roof cleaning near me prices	50	Unknown			0%	C	Roof Cleaning	Batch 4 - Head Terms
residential window washers near me	50	High			0%	T/L	Window Cleaning	Batch 4 - Head Terms
window washing companies near me	50	High			0%	T/L	Window Cleaning	Batch 4 - Head Terms
gutter cleaning services in my area	50	Unknown			0%	T	Gutter Services	Batch 4 - Head Terms
concrete cleaning near me	50	High			∞	T/L	Concrete Cleaning	Batch 4 - Head Terms
pressure cleaning services near me	50	Unknown			0%	T/L	Pressure Washing	Batch 4 - Head Terms
affordable window cleaning near me	50	Unknown			0%	T/L	Window Cleaning	Batch 4 - Head Terms
window washers in my area	50	Medium			0%	T	Window Cleaning	Batch 4 - Head Terms
patio power washing near me	50	Unknown			0%	T/L	Pressure Washing	Batch 4 - Head Terms
window and gutter cleaning near me	50	Unknown			-100%	T/L	Gutter Services	Batch 4 - Head Terms
best residential window washers near me	50	Unknown			0%	T/L	Window Cleaning	Batch 4 - Head Terms
local gutter cleaning services	50	Low			∞	T	Gutter Services	Batch 4 - Head Terms
commercial pressure washer trailer	50	Medium			0%	T	Industrial	Batch 4 - Head Terms
gutter cleaning and repairs near me	50	Unknown			-100%	T/L	Gutter Services	Batch 4 - Head Terms
roof moss cleaning near me	50	Unknown			0%	T/L	Roof Cleaning	Batch 4 - Head Terms
gutter and downspout cleaning near me	50	High			∞	T/L	Gutter Services	Batch 4 - Head Terms
gutter cleaning near me cost	50	Unknown			0%	C	Gutter Services	Batch 4 - Head Terms
roof washing companies near me	50	High			0%	T/L	Roof Cleaning	Batch 4 - Head Terms
roof washers near me	50	High	1.33	12.73	0%	T/L	Roof Cleaning	Batch 4 - Head Terms
leaf gutter cleaning near me	50	Unknown			0%	T/L	Gutter Services	Batch 4 - Head Terms
window cleaning near me residential	50	High			0%	T/L	Window Cleaning	Batch 4 - Head Terms
soft roof cleaning near me	50	Unknown			0%	T/L	Roof Cleaning	Batch 4 - Head Terms
pressure washing prices near me	50	High			0%	C	Pressure Washing	Batch 4 - Head Terms
the gutter guys near me	50	Unknown			-100%	T/L	Gutter Services	Batch 4 - Head Terms
gutter cleaning and power washing near me	50	Unknown			0%	T/L	Pressure Washing	Batch 4 - Head Terms
concrete cleaning services near me	50	Unknown			-100%	T/L	Concrete Cleaning	Batch 4 - Head Terms
residential power washing services near me	50	High			∞	T/L	Pressure Washing	Batch 4 - Head Terms
exterior house cleaning services near me	50	Unknown			0%	T/L		Batch 4 - Head Terms
commercial gutter cleaning near me	50	High			∞	T/L	Gutter Services	Batch 4 - Head Terms
commercial hot water pressure washer	50	High			0%	T	Industrial	Batch 4 - Head Terms
soft house washing near me	50	Unknown			-100%	T/L	Soft Washing	Batch 4 - Head Terms
clean out gutters near me	50	High			∞	T/L	Gutter Services	Batch 4 - Head Terms
driveway cleaning services near me	50	Low			900%	T/L	Concrete Cleaning	Batch 4 - Head Terms
power wash driveway near me	50	Unknown			-100%	T/L	Pressure Washing	Batch 4 - Head Terms
power washing in my area	50	Unknown			0%	T	Pressure Washing	Batch 4 - Head Terms
post construction cleaning services near me	50	Unknown			-100%	T/L	Construction Cleanup	Batch 4 - Head Terms
post renovation cleaning services near me	50	Unknown			-100%	T/L		Batch 4 - Head Terms
road striping companies near me	50	Unknown			-100%	T/L	Parking Lot Services	Batch 4 - Head Terms
roof pressure washing near me	50	Low			∞	T/L	Pressure Washing	Batch 4 - Head Terms
home window cleaning near me	50	Unknown			-100%	T/L	Window Cleaning	Batch 4 - Head Terms
roof power washing near me	50	Unknown			0%	T/L	Pressure Washing	Batch 4 - Head Terms
best window cleaners near me	50	Medium			0%	T/L	Window Cleaning	Batch 4 - Head Terms
house soft washing near me	50	Low			∞	T/L	Soft Washing	Batch 4 - Head Terms
best power washing companies near me	50	Unknown			0%	T/L	Pressure Washing	Batch 4 - Head Terms
powerwashing in my area	50	Unknown			0%	T		Batch 4 - Head Terms
window well cleaning service near me	50	Unknown			0%	T/L	Window Cleaning	Batch 4 - Head Terms
post construction cleaning near me	50	Unknown			-100%	T/L	Construction Cleanup	Batch 4 - Head Terms
power wash roof near me	50	Unknown			0%	T/L	Pressure Washing	Batch 4 - Head Terms
deck cleaning services near me	50	Unknown			-100%	T/L	Deck & Fence	Batch 4 - Head Terms
local gutter cleaners near me	50	Low			∞	T/L	Gutter Services	Batch 4 - Head Terms
solar panels cleaning near me	50	Low			0%	T/L		Batch 4 - Head Terms
exterior cleaning services near me	50	Unknown			0%	T/L		Batch 4 - Head Terms
gutter cleaning companies in my area	50	Low			∞	T	Gutter Services	Batch 4 - Head Terms
exterior house washing services near me	50	Unknown			0%	T/L	Soft Washing	Batch 4 - Head Terms
siding washing near me	50	Low			∞	T/L		Batch 4 - Head Terms
house power washing services near me	50	Unknown			0%	T/L	Pressure Washing	Batch 4 - Head Terms
professional window cleaners near me	50	Medium			0%	T/L	Window Cleaning	Batch 4 - Head Terms
gutter cleaning and maintenance near me	50	Unknown			0%	T/L	Gutter Services	Batch 4 - Head Terms
soft wash companies near me	50	Low			0%	T/L	Soft Washing	Batch 4 - Head Terms
residential pressure washing near me	50	Unknown			0%	T/L	Pressure Washing	Batch 4 - Head Terms
pressure washing prices per square foot commercial	50	Unknown			0%	T	Industrial	Batch 4 - Head Terms
someone to clean gutters near me	50	Unknown			0%	T/L	Gutter Services	Batch 4 - Head Terms
underground gutter drain cleaning near me	50	Unknown			0%	T/L	Gutter Services	Batch 4 - Head Terms
gutter drain cleaning near me	50	Unknown			0%	T/L	Gutter Services	Batch 4 - Head Terms
soft wash roof cleaning near me	50	Low			0%	T/L	Soft Washing	Batch 4 - Head Terms
roof tile cleaning near me	50	Unknown			0%	T/L	Roof Cleaning	Batch 4 - Head Terms
pressure washing in my area	50	Unknown			-100%	T	Pressure Washing	Batch 4 - Head Terms
commercial pressure washing companies near me	50	Unknown			-100%	T/L	Industrial	Batch 4 - Head Terms
parking lot maintenance near me	50	High			∞	T/L	Parking Lot Services	Batch 4 - Head Terms
best pressure washer for business	50	High			0%	I	Pressure Washing	Batch 4 - Head Terms
vinyl siding cleaning near me	50	Unknown			0%	T/L		Batch 4 - Head Terms
cedar roof cleaning near me	50	Unknown			0%	T/L	Roof Cleaning	Batch 4 - Head Terms
local window washers	50	High			0%	T	Window Cleaning	Batch 4 - Head Terms
gutter leaf removal near me	50	Unknown			0%	T/L	Gutter Services	Batch 4 - Head Terms
roof gutter repairs near me	50	Unknown			0%	T/L	Roof Cleaning	Batch 4 - Head Terms
roof power washing services near me	50	Unknown			-100%	T/L	Pressure Washing	Batch 4 - Head Terms
roof shampoo near me	50	Unknown			0%	T/L	Roof Cleaning	Batch 4 - Head Terms
professional power washing services	50	Low			0%	T	Pressure Washing	Batch 4 - Head Terms
roof soft washing near me	50	Low			∞	T/L	Soft Washing	Batch 4 - Head Terms
pressure washer business near me	50	Medium	1.70	8.00	0%	T/L	Pressure Washing	Batch 4 - Head Terms
parking lot sealcoating near me	50	High			∞	T/L	Parking Lot Services	Batch 4 - Head Terms
house washing companies near me	50	Low			∞	T/L	Soft Washing	Batch 4 - Head Terms
house window cleaning near me	50	High			0%	T/L	Window Cleaning	Batch 4 - Head Terms
window and screen cleaning near me	50	Unknown			0%	T/L	Window Cleaning	Batch 4 - Head Terms
commercial power washing companies near me	50	High			∞	T/L	Industrial	Batch 4 - Head Terms
exterior power washing near me	50	Unknown			0%	T/L	Pressure Washing	Batch 4 - Head Terms
parking lot asphalt repair	50	Low			∞	T	Parking Lot Services	Batch 4 - Head Terms
gutters cleaned out near me	50	Unknown			0%	T/L	Gutter Services	Batch 4 - Head Terms
power washing business near me	50	Medium			0%	T/L	Pressure Washing	Batch 4 - Head Terms
power wash siding near me	50	Unknown			0%	T/L	Pressure Washing	Batch 4 - Head Terms
after renovation cleaning service near me	50	Unknown			-100%	T/L		Batch 4 - Head Terms
cost of gutter cleaning near me	50	Unknown			0%	C	Gutter Services	Batch 4 - Head Terms
roof gutter cleaning services near me	50	Unknown			0%	T/L	Roof Cleaning	Batch 4 - Head Terms
siding power washing near me	50	Unknown			-100%	T/L	Pressure Washing	Batch 4 - Head Terms
residential gutter cleaning near me	50	High			∞	T/L	Gutter Services	Batch 4 - Head Terms
shingle roof cleaning near me	50	Unknown			0%	T/L	Roof Cleaning	Batch 4 - Head Terms
rain gutter cleaning service near me	50	Unknown			0%	T/L	Gutter Services	Batch 4 - Head Terms
roof cleaning cost near me	50	Unknown			0%	C	Roof Cleaning	Batch 4 - Head Terms
soft wash house cleaning near me	50	Unknown			0%	T/L	Soft Washing	Batch 4 - Head Terms
power washing and gutter cleaning near me	50	Unknown			0%	T/L	Pressure Washing	Batch 4 - Head Terms
parking lot repair companies near me	50	High			∞	T/L	Parking Lot Services	Batch 4 - Head Terms
downspout cleaning near me	50	Unknown			0%	T/L		Batch 4 - Head Terms
house gutter cleaning near me	50	Unknown			-100%	T/L	Gutter Services	Batch 4 - Head Terms
parking lot sealcoating	50	Medium			0%	T	Parking Lot Services	Batch 4 - Head Terms
power washing services cost	50	Medium			∞	T	Pressure Washing	Batch 4 - Head Terms
best window washers near me	50	Medium			0%	T/L	Window Cleaning	Batch 4 - Head Terms
commercial window washers near me	50	Low			0%	T/L	Window Cleaning	Batch 4 - Head Terms
rain gutter repairs near me	50	Unknown			0%	T/L	Gutter Services	Batch 4 - Head Terms
power house washing near me	50	Unknown			0%	T/L	Soft Washing	Batch 4 - Head Terms
power wash my house near me	50	Unknown			0%	T/L	Pressure Washing	Batch 4 - Head Terms
jet washing near me	50	Low			∞	T/L		Batch 4 - Head Terms
softwashing near me	50	Low			0%	T/L		Batch 4 - Head Terms
home power washing cost	50	Unknown			-100%	T	Pressure Washing	Batch 4 - Head Terms
best roof cleaning near me	50	Unknown			0%	T/L	Roof Cleaning	Batch 4 - Head Terms
gutter and drain cleaning near me	50	Unknown			0%	T/L	Gutter Services	Batch 4 - Head Terms
concrete power washing near me	50	Unknown			0%	T/L	Pressure Washing	Batch 4 - Head Terms
deck washing near me	50	Unknown			0%	T/L	Deck & Fence	Batch 4 - Head Terms
low pressure roof cleaning near me	50	Unknown			0%	T/L	Roof Cleaning	Batch 4 - Head Terms
parking lot repair companies	50	Unknown			-100%	T	Parking Lot Services	Batch 4 - Head Terms
roof mold removal near me	50	Unknown			-100%	T/L	Roof Cleaning	Batch 4 - Head Terms
gutter service in my area	50	Unknown			-100%	T	Gutter Services	Batch 4 - Head Terms
power washing companies in my area	50	High			0%	T	Pressure Washing	Batch 4 - Head Terms
exterior window cleaners near me	50	High			∞	T/L	Window Cleaning	Batch 4 - Head Terms
cheap power washing near me	50	High			0%	T/L	Pressure Washing	Batch 4 - Head Terms
gutter cleaners near my location	50	Unknown			0%	T	Gutter Services	Batch 4 - Head Terms
affordable pressure washing near me	50	High			∞	T/L	Pressure Washing	Batch 4 - Head Terms
cedar shake roof cleaning near me	50	Unknown			0%	T/L	Roof Cleaning	Batch 4 - Head Terms
house power washing companies	50	Unknown			0%	T	Pressure Washing	Batch 4 - Head Terms
pressure wash driveway near me	50	High			∞	T/L	Pressure Washing	Batch 4 - Head Terms
electric commercial pressure washer	50	High	0.47	3.28	0%	T	Industrial	Batch 4 - Head Terms
slate roof cleaning near me	50	Unknown			-100%	T/L	Roof Cleaning	Batch 4 - Head Terms
power wash homes near me	50	Unknown			0%	T/L	Pressure Washing	Batch 4 - Head Terms
concrete cleaning company near me	50	Unknown			-100%	T/L	Concrete Cleaning	Batch 4 - Head Terms
gutter removal near me	50	Unknown			0%	T/L	Gutter Services	Batch 4 - Head Terms
window washers residential near me	50	High			∞	T/L	Window Cleaning	Batch 4 - Head Terms
parking lot restriping near me	50	Unknown			0%	T/L	Parking Lot Services	Batch 4 - Head Terms
mobile home power washing services near me	50	Unknown			0%	T/L	Pressure Washing	Batch 4 - Head Terms
exterior home cleaning near me	50	Unknown			0%	T/L		Batch 4 - Head Terms
commercial jet wash	50	Unknown			0%	T		Batch 4 - Head Terms
home power washing services near me	50	Unknown			-100%	T/L	Pressure Washing	Batch 4 - Head Terms
clean rain gutters near me	50	Unknown			0%	T/L	Gutter Services	Batch 4 - Head Terms
local pressure washing services	50	Medium			∞	T	Pressure Washing	Batch 4 - Head Terms
gutter cleaning and pressure washing near me	50	Unknown			-100%	T/L	Pressure Washing	Batch 4 - Head Terms
power washing decks near me	50	Unknown			0%	T/L	Pressure Washing	Batch 4 - Head Terms
gutter doctor near me	50	Unknown			0%	T/L	Gutter Services	Batch 4 - Head Terms
high rise window cleaning near me	50	Unknown			0%	T/L	Window Cleaning	Batch 4 - Head Terms
local gutter cleaning companies near me	50	Unknown			0%	T/L	Gutter Services	Batch 4 - Head Terms
commercial roof cleaning services near me	50	Unknown			0%	T/L	Roof Cleaning	Batch 4 - Head Terms
concrete driveway cleaning near me	50	Unknown			0%	T/L	Concrete Cleaning	Batch 4 - Head Terms
residential window cleaning services near me	50	Unknown			-100%	T/L	Window Cleaning	Batch 4 - Head Terms
best commercial power washer	50	High	0.57	1.90	0%	I	Industrial	Batch 4 - Head Terms
asphalt parking lot repair near me	50	High			∞	T/L	Parking Lot Services	Batch 4 - Head Terms
exterior window washers near me	50	Unknown			0%	T/L	Window Cleaning	Batch 4 - Head Terms
pressure wash my house near me	50	Unknown			0%	T/L	Pressure Washing	Batch 4 - Head Terms
gutter cleaner in my area	50	High			0%	T	Gutter Services	Batch 4 - Head Terms
commercial pressure washing near me	50	Unknown			-100%	T/L	Industrial	Batch 4 - Head Terms
shine window cleaning near me	50	Unknown			0%	T/L	Window Cleaning	Batch 4 - Head Terms
local power washing services	50	Medium			∞	T	Pressure Washing	Batch 4 - Head Terms
roof washing services near me	50	High			∞	T/L	Roof Cleaning	Batch 4 - Head Terms
pressure washing companies in my area	50	Low			0%	T	Pressure Washing	Batch 4 - Head Terms
moss roof cleaning near me	50	Unknown			0%	T/L	Roof Cleaning	Batch 4 - Head Terms
local roof cleaners	50	Unknown			0%	T	Roof Cleaning	Batch 4 - Head Terms
residential power washing near me	50	Unknown			0%	T/L	Pressure Washing	Batch 4 - Head Terms
house siding cleaning near me	50	Unknown			0%	T/L		Batch 4 - Head Terms
window blind cleaning near me	50	High			0%	T/L	Window Cleaning	Batch 4 - Head Terms
pressure wash roof near me	50	Unknown			0%	T/L	Pressure Washing	Batch 4 - Head Terms
local window cleaners near me	50	Unknown			0%	T/L	Window Cleaning	Batch 4 - Head Terms
commercial window cleaning services near me	50	Unknown			-100%	T/L	Window Cleaning	Batch 4 - Head Terms
commercial power washing services near me	50	High			∞	T/L	Industrial	Batch 4 - Head Terms
concrete pressure washing near me	50	Unknown			0%	T/L	Pressure Washing	Batch 4 - Head Terms
best gutter cleaning service near me	50	High			0%	T/L	Gutter Services	Batch 4 - Head Terms
mobile home pressure washing near me	50	Unknown			0%	T/L	Pressure Washing	Batch 4 - Head Terms
home window washers near me	50	Unknown			0%	T/L	Window Cleaning	Batch 4 - Head Terms
companies that clean gutters near me	50	Unknown			0%	T/L	Gutter Services	Batch 4 - Head Terms
clean my roof near me	50	Unknown			0%	T/L	Roof Cleaning	Batch 4 - Head Terms
roof washer near me	50	High	1.33	12.73	0%	T/L	Roof Cleaning	Batch 4 - Head Terms
best pressure washing company near me	50	Unknown			0%	T/L	Pressure Washing	Batch 4 - Head Terms
fish windows near me	50	Unknown			0%	T/L	Window Cleaning	Batch 4 - Head Terms
soft wash power washing near me	50	Unknown			0%	T/L	Pressure Washing	Batch 4 - Head Terms
powerwashers near me	50	Unknown			0%	T/L		Batch 4 - Head Terms
glass cleaning company near me	50	Unknown			0%	T/L	Window Cleaning	Batch 4 - Head Terms
pressure washing and gutter cleaning near me	50	Unknown			0%	T/L	Pressure Washing	Batch 4 - Head Terms
house exterior cleaning near me	50	Unknown			-100%	T/L		Batch 4 - Head Terms
construction cleaning near me	50	Unknown			-100%	T/L	Construction Cleanup	Batch 4 - Head Terms
pressure washing homes near me	50	Low			∞	T/L	Pressure Washing	Batch 4 - Head Terms
siding washers near me	50	Low			∞	T/L		Batch 4 - Head Terms
power wash siding cost	50	Unknown			-100%	T	Pressure Washing	Batch 4 - Head Terms
mobile power washing near me	50	Unknown			0%	T/L	Pressure Washing	Batch 4 - Head Terms
professional electric pressure washer	50	Unknown			-100%	T	Pressure Washing	Batch 4 - Head Terms
roof washers in my area	50	Unknown			0%	T	Roof Cleaning	Batch 4 - Head Terms
roof and gutter cleaning services near me	50	Unknown			0%	T/L	Roof Cleaning	Batch 4 - Head Terms
local pressure washing companies	50	Medium			∞	T	Pressure Washing	Batch 4 - Head Terms
affordable gutter cleaning near me	50	High			∞	T/L	Gutter Services	Batch 4 - Head Terms
home pressure washing services near me	50	Unknown			0%	T/L	Pressure Washing	Batch 4 - Head Terms
high pressure cleaning near me	50	Unknown			0%	T/L	Pressure Washing	Batch 4 - Head Terms
siding cleaning companies near me	50	Unknown			-100%	T/L		Batch 4 - Head Terms
gutter shutter near me	50	Unknown			-100%	T/L	Gutter Services	Batch 4 - Head Terms
mobile truck washing near me	50	High			∞	T/L	Fleet Washing	Batch 4 - Head Terms
skylight cleaning service near me	50	Unknown			0%	T/L		Batch 4 - Head Terms
commercial parking lot repair	50	Unknown			0%	T	Parking Lot Services	Batch 4 - Head Terms
home window washing near me	50	Unknown			0%	T/L	Window Cleaning	Batch 4 - Head Terms
best pressure washing near me	50	Unknown			0%	T/L	Pressure Washing	Batch 4 - Head Terms
price to power wash house	50	Unknown			0%	T	Pressure Washing	Batch 4 - Head Terms
best commercial electric pressure washer	50	High			∞	I	Industrial	Batch 4 - Head Terms
driveway power washing services near me	50	Unknown			0%	T/L	Pressure Washing	Batch 4 - Head Terms
power washing and window cleaning near me	50	Unknown			0%	T/L	Pressure Washing	Batch 4 - Head Terms
roof and siding cleaning near me	50	Unknown			0%	T/L	Roof Cleaning	Batch 4 - Head Terms
