Keyword	Avg Monthly Volume	Competition	CPC Low	CPC High	YoY Change	Intent	Silo Assignment	Source Batch
industrial pressure washing	50	High	0.89	4.17	0%	T	Industrial	Batch 4 - Head Terms
concrete parking lot repair	50	High			0%	T	Concrete Cleaning	Batch 4 - Head Terms
cheap pressure washing near me	50	Unknown			-100%	T/L	Pressure Washing	Batch 4 - Head Terms
shingle cleaning near me	50	High			0%	T/L		Batch 4 - Head Terms
professional power washing near me	50	Unknown			0%	T/L	Pressure Washing	Batch 4 - Head Terms
roof cleaning companies in my area	50	Unknown			0%	T	Roof Cleaning	Batch 4 - Head Terms
soft wash services near me	50	Low			∞	T/L	Soft Washing	Batch 4 - Head Terms
parking lot maintenance company	50	Low			∞	T	Parking Lot Services	Batch 4 - Head Terms
home gutter cleaning near me	50	Unknown			0%	T/L	Gutter Services	Batch 4 - Head Terms
roof cleaning contractors near me	50	Unknown			0%	T/L	Roof Cleaning	Batch 4 - Head Terms
roof steaming near me	50	Unknown			0%	T/L	Roof Cleaning	Batch 4 - Head Terms
after construction cleaning services near me	50	Unknown			0%	T/L	Construction Cleanup	Batch 4 - Head Terms
power wash house service	50	Low			∞	T	Pressure Washing	Batch 4 - Head Terms
soft wash house washing near me	50	Unknown			0%	T/L	Soft Washing	Batch 4 - Head Terms
roofing cleaning companies near me	50	Medium			0%	T/L	Roof Cleaning	Batch 4 - Head Terms
window cleaning companies in my area	50	Low			0%	T	Window Cleaning	Batch 4 - Head Terms
house roof cleaning near me	50	Unknown			0%	T/L	Roof Cleaning	Batch 4 - Head Terms
average power washing cost	50	Medium			0%	T	Pressure Washing	Batch 4 - Head Terms
fence pressure washing near me	50	Unknown			-100%	T/L	Pressure Washing	Batch 4 - Head Terms
local gutter cleaning companies	50	Unknown			0%	T	Gutter Services	Batch 4 - Head Terms
metal roof cleaning services near me	50	Unknown			0%	T/L	Roof Cleaning	Batch 4 - Head Terms
power wash contractors near me	50	Low			0%	T/L	Pressure Washing	Batch 4 - Head Terms
local window cleaners in my area	50	Unknown			0%	T	Window Cleaning	Batch 4 - Head Terms
local power washing near me	50	Unknown			0%	T/L	Pressure Washing	Batch 4 - Head Terms
new construction cleaning services near me	50	Medium			∞	T/L	Construction Cleanup	Batch 4 - Head Terms
commercial power washer trailer	50	Medium			0%	T	Industrial	Batch 4 - Head Terms
renovation cleaning services near me	50	Unknown			0%	T/L		Batch 4 - Head Terms
fence power washing near me	50	Unknown			0%	T/L	Pressure Washing	Batch 4 - Head Terms
jet wash company near me	50	Unknown			0%	T/L		Batch 4 - Head Terms
best commercial hot water pressure washer	50	High			∞	I	Industrial	Batch 4 - Head Terms
residential pressure washing services near me	50	Unknown			-100%	T/L	Pressure Washing	Batch 4 - Head Terms
commercial pressure washing company	50	Low			0%	T	Industrial	Batch 4 - Head Terms
local guttering repairs	50	Unknown			0%	T	Gutter Services	Batch 4 - Head Terms
find gutter cleaners near me	50	Unknown			0%	T/L	Gutter Services	Batch 4 - Head Terms
pressure house washing near me	50	Unknown			0%	T/L	Soft Washing	Batch 4 - Head Terms
best gutter cleaning company near me	50	Unknown			0%	T/L	Gutter Services	Batch 4 - Head Terms
clear gutters near me	50	Unknown			0%	T/L	Gutter Services	Batch 4 - Head Terms
vinyl siding cleaning services near me	50	Unknown			0%	T/L		Batch 4 - Head Terms
local roof cleaning services	50	Unknown			0%	T	Roof Cleaning	Batch 4 - Head Terms
local window washers near me	50	Unknown			0%	T/L	Window Cleaning	Batch 4 - Head Terms
house washing in my area	50	Unknown			0%	T	Soft Washing	Batch 4 - Head Terms
driveway washing near me	50	Unknown			0%	T/L	Concrete Cleaning	Batch 4 - Head Terms
pressure washer for business	50	Medium	0.47	6.05	0%	T	Pressure Washing	Batch 4 - Head Terms
power washing services in my area	50	Low			∞	T	Pressure Washing	Batch 4 - Head Terms
companies that pressure wash houses near me	50	Unknown			0%	T/L	Pressure Washing	Batch 4 - Head Terms
commercial power washing near me	50	Unknown			0%	T/L	Industrial	Batch 4 - Head Terms
deck pressure washing near me	50	Unknown			-100%	T/L	Pressure Washing	Batch 4 - Head Terms
power washing prices near me	50	High			0%	C	Pressure Washing	Batch 4 - Head Terms
house and window washing near me	50	Unknown			0%	T/L	Window Cleaning	Batch 4 - Head Terms
vinyl siding cleaning companies near me	50	High			∞	T/L		Batch 4 - Head Terms
jet cleaning services near me	50	Unknown			0%	T/L		Batch 4 - Head Terms
best window cleaning company near me	50	Unknown			0%	T/L	Window Cleaning	Batch 4 - Head Terms
soft washing house exterior near me	50	Unknown			0%	T/L	Soft Washing	Batch 4 - Head Terms
business window cleaning near me	50	Unknown			0%	T/L	Window Cleaning	Batch 4 - Head Terms
outside house washing near me	50	Unknown			0%	T/L	Soft Washing	Batch 4 - Head Terms
commercial gutter cleaning services near me	50	Unknown			0%	T/L	Gutter Services	Batch 4 - Head Terms
best professional pressure washer	50	Unknown			0%	I	Pressure Washing	Batch 4 - Head Terms
dumpster pad cleaning	50	Low			0%	T		Batch 4 - Head Terms
soft roof washing near me	50	Unknown			-100%	T/L	Roof Cleaning	Batch 4 - Head Terms
roof debris removal near me	50	Unknown			-100%	T/L	Roof Cleaning	Batch 4 - Head Terms
parking lot maintenance services	50	Low			0%	T	Parking Lot Services	Batch 4 - Head Terms
window maintenance services near me	50	Unknown			0%	T/L	Window Cleaning	Batch 4 - Head Terms
brick power washing near me	50	Unknown			0%	T/L	Pressure Washing	Batch 4 - Head Terms
siding washing companies near me	50	Unknown			0%	T/L		Batch 4 - Head Terms
house power washing near me cost	50	Unknown			0%	C	Pressure Washing	Batch 4 - Head Terms
professional power washers near me	50	Unknown			0%	T/L	Pressure Washing	Batch 4 - Head Terms
best pressure washer for commercial use	50	High			0%	I	Industrial	Batch 4 - Head Terms
metal roof cleaning companies near me	50	Unknown			0%	T/L	Roof Cleaning	Batch 4 - Head Terms
mobile commercial truck wash near me	50	Unknown			0%	T/L	Fleet Washing	Batch 4 - Head Terms
mobile home power washing near me	50	Unknown			0%	T/L	Pressure Washing	Batch 4 - Head Terms
paver power washing near me	50	Unknown			0%	T/L	Pressure Washing	Batch 4 - Head Terms
eco friendly roof cleaning near me	50	Unknown			-100%	T/L	Roof Cleaning	Batch 4 - Head Terms
construction clean up services near me	50	Unknown			-100%	T/L	Construction Cleanup	Batch 4 - Head Terms
local window washing companies	50	Unknown			-100%	T	Window Cleaning	Batch 4 - Head Terms
moss roof removal near me	50	Unknown			0%	T/L	Roof Cleaning	Batch 4 - Head Terms
window and siding cleaning near me	50	Unknown			0%	T/L	Window Cleaning	Batch 4 - Head Terms
window washing companies in my area	50	Unknown			0%	T	Window Cleaning	Batch 4 - Head Terms
mobile truck washing service near me	50	Unknown			0%	T/L	Fleet Washing	Batch 4 - Head Terms
external house cleaning near me	50	Unknown			0%	T/L		Batch 4 - Head Terms
roof steam cleaning near me	50	Unknown			0%	T/L	Roof Cleaning	Batch 4 - Head Terms
mobile power washing companies near me	50	Unknown			0%	T/L	Pressure Washing	Batch 4 - Head Terms
professional window washers near me	50	Low			∞	T/L	Window Cleaning	Batch 4 - Head Terms
gutter cleaning nearby	50	Low			∞	T	Gutter Services	Batch 4 - Head Terms
best power washing near me	50	Unknown			0%	T/L	Pressure Washing	Batch 4 - Head Terms
commercial exterior cleaning services	50	Unknown			0%	T		Batch 4 - Head Terms
average price to power wash a house	50	Low			∞	T	Pressure Washing	Batch 4 - Head Terms
copper roof cleaning near me	50	Unknown			0%	T/L	Roof Cleaning	Batch 4 - Head Terms
average cost of gutter cleaning near me	50	Unknown			0%	C	Gutter Services	Batch 4 - Head Terms
sunshine window cleaning near me	50	Unknown			0%	T/L	Window Cleaning	Batch 4 - Head Terms
residential window washers in my area	50	Unknown			0%	T	Window Cleaning	Batch 4 - Head Terms
construction cleaning companies near me	50	Unknown			-100%	T/L	Construction Cleanup	Batch 4 - Head Terms
residential roof cleaning near me	50	Unknown			0%	T/L	Roof Cleaning	Batch 4 - Head Terms
fence cleaning near me	50	Unknown			0%	T/L	Deck & Fence	Batch 4 - Head Terms
commercial power washing services	50	Unknown			0%	T	Industrial	Batch 4 - Head Terms
mobile power washing services near me	50	Unknown			-100%	T/L	Pressure Washing	Batch 4 - Head Terms
power washing service prices	50	Unknown			-100%	T	Pressure Washing	Batch 4 - Head Terms
roof treatment near me	50	High			∞	T/L	Roof Cleaning	Batch 4 - Head Terms
local guttering services	50	Unknown			0%	T	Gutter Services	Batch 4 - Head Terms
home exterior power washing services	50	Unknown			0%	T	Pressure Washing	Batch 4 - Head Terms
house window washers near me	50	Unknown			0%	T/L	Window Cleaning	Batch 4 - Head Terms
professional pressure washing near me	50	Unknown			-100%	T/L	Pressure Washing	Batch 4 - Head Terms
roof sweeping near me	50	Unknown			0%	T/L	Roof Cleaning	Batch 4 - Head Terms
parking lot pothole repair	50	Medium			∞	T	Parking Lot Services	Batch 4 - Head Terms
commercial pressure cleaning	50	High	0.82	2.93	0%	T	Industrial	Batch 4 - Head Terms
patio washing near me	50	Unknown			0%	T/L		Batch 4 - Head Terms
commercial hot pressure washer	50	Unknown			0%	T	Industrial	Batch 4 - Head Terms
commercial pressure washing services near me	50	Unknown			0%	T/L	Industrial	Batch 4 - Head Terms
power wash exterior of house cost	50	Unknown			0%	T	Pressure Washing	Batch 4 - Head Terms
gutter and window cleaning services near me	50	Unknown			0%	T/L	Gutter Services	Batch 4 - Head Terms
power washing gutter cleaning near me	50	Unknown			0%	T/L	Pressure Washing	Batch 4 - Head Terms
hot water pressure washing near me	50	High			0%	T/L	Pressure Washing	Batch 4 - Head Terms
commercial powerwashing	50	Unknown			0%	T		Batch 4 - Head Terms
window and house washing near me	50	Unknown			-100%	T/L	Soft Washing	Batch 4 - Head Terms
parking lot sealcoating and striping	50	Unknown			0%	T	Parking Lot Services	Batch 4 - Head Terms
underground gutter cleaning near me	50	Unknown			0%	T/L	Gutter Services	Batch 4 - Head Terms
window cleaning and gutter cleaning near me	50	Unknown			0%	T/L	Gutter Services	Batch 4 - Head Terms
home exterior cleaning near me	50	Unknown			0%	T/L		Batch 4 - Head Terms
commercial concrete cleaning	50	Unknown			-100%	T	Concrete Cleaning	Batch 4 - Head Terms
window gutter cleaning near me	50	Unknown			-100%	T/L	Gutter Services	Batch 4 - Head Terms
fleet washing services near me	50	Unknown			0%	T/L	Fleet Washing	Batch 4 - Head Terms
house siding washing near me	50	Unknown			0%	T/L		Batch 4 - Head Terms
powerwasher nearby	50	High			0%	T		Batch 4 - Head Terms
sparkle wash near me	50	Unknown			0%	T/L		Batch 4 - Head Terms
power washing cost per hour	50	Low			∞	T	Pressure Washing	Batch 4 - Head Terms
gutter roof cleaning near me	50	Unknown			0%	T/L	Roof Cleaning	Batch 4 - Head Terms
home power washing companies near me	50	Unknown			0%	T/L	Pressure Washing	Batch 4 - Head Terms
commercial steam pressure washer	50	High			0%	T	Industrial	Batch 4 - Head Terms
gutter guru near me	50	Unknown			0%	T/L	Gutter Services	Batch 4 - Head Terms
cleaning gutters company near me	50	Unknown			0%	T/L	Gutter Services	Batch 4 - Head Terms
commercial electric hot water pressure washer	50	Unknown			0%	T	Industrial	Batch 4 - Head Terms
home power washing companies	50	Unknown			0%	T	Pressure Washing	Batch 4 - Head Terms
exterior power washing services near me	50	Unknown			0%	T/L	Pressure Washing	Batch 4 - Head Terms
home power washing service	50	Low			∞	T	Pressure Washing	Batch 4 - Head Terms
interior window cleaning near me	50	Unknown			-100%	T/L	Window Cleaning	Batch 4 - Head Terms
pressure washing services in my area	50	Unknown			0%	T	Pressure Washing	Batch 4 - Head Terms
stucco power wash near me	50	Unknown			0%	T/L	Pressure Washing	Batch 4 - Head Terms
glass cleaning services near me	50	Unknown			0%	T/L	Window Cleaning	Batch 4 - Head Terms
pressure washing contractors near me	50	Low			0%	T/L	Pressure Washing	Batch 4 - Head Terms
affordable power washing near me	50	Unknown			-100%	T/L	Pressure Washing	Batch 4 - Head Terms
companies that power wash houses near me	50	Unknown			0%	T/L	Pressure Washing	Batch 4 - Head Terms
gutter and soffit cleaning near me	50	Unknown			0%	T/L	Gutter Services	Batch 4 - Head Terms
vinyl siding washing near me	50	Unknown			0%	T/L		Batch 4 - Head Terms
residential power washing companies near me	50	Unknown			0%	T/L	Pressure Washing	Batch 4 - Head Terms
siding cleaning service near me	50	Unknown			0%	T/L		Batch 4 - Head Terms
pressure washer cleaners near me	50	Unknown			0%	T/L	Pressure Washing	Batch 4 - Head Terms
vinyl fence cleaning service near me	50	Unknown			0%	T/L	Deck & Fence	Batch 4 - Head Terms
window well cleaning near me	50	Unknown			0%	T/L	Window Cleaning	Batch 4 - Head Terms
power washing patios near me	50	Unknown			0%	T/L	Pressure Washing	Batch 4 - Head Terms
average price for power washing	50	Low			∞	T	Pressure Washing	Batch 4 - Head Terms
top rated power washing companies near me	50	Unknown			0%	T/L	Pressure Washing	Batch 4 - Head Terms
house power washing companies near me	50	Unknown			0%	T/L	Pressure Washing	Batch 4 - Head Terms
powerwashing company near me	50	Unknown			0%	T/L		Batch 4 - Head Terms
cost of window washing near me	50	Unknown			0%	C	Window Cleaning	Batch 4 - Head Terms
concrete parking lot repair near me	50	Unknown			0%	T/L	Concrete Cleaning	Batch 4 - Head Terms
home window cleaning services near me	50	Unknown			0%	T/L	Window Cleaning	Batch 4 - Head Terms
roof and house washing near me	50	Unknown			0%	T/L	Soft Washing	Batch 4 - Head Terms
commercial guttering repairs	50	High			0%	T	Gutter Services	Batch 4 - Head Terms
water pressure cleaning near me	50	Unknown			0%	T/L	Pressure Washing	Batch 4 - Head Terms
house power washers in my area	50	Unknown			0%	T	Pressure Washing	Batch 4 - Head Terms
black owned pressure washing near me	50	Unknown			0%	T/L	Pressure Washing	Batch 4 - Head Terms
house power washing in my area	50	Unknown			0%	T	Pressure Washing	Batch 4 - Head Terms
leaf removal and gutter cleaning near me	50	Unknown			0%	T/L	Gutter Services	Batch 4 - Head Terms
window cleaning business near me	50	High			∞	T/L	Window Cleaning	Batch 4 - Head Terms
pressure washer for commercial use	50	Unknown			0%	T	Industrial	Batch 4 - Head Terms
commercial high pressure washer	50	Unknown			0%	T	Industrial	Batch 4 - Head Terms
power wash house service near me	50	Unknown			0%	T/L	Pressure Washing	Batch 4 - Head Terms
driveway pressure cleaning near me	50	Unknown			0%	T/L	Pressure Washing	Batch 4 - Head Terms
building pressure washing near me	50	Unknown			0%	T/L	Pressure Washing	Batch 4 - Head Terms
black owned power washing near me	50	Unknown			0%	T/L	Pressure Washing	Batch 4 - Head Terms
power washing cost per square foot	50	Low			0%	T	Pressure Washing	Batch 4 - Head Terms
commercial window washing companies near me	50	Unknown			0%	T/L	Window Cleaning	Batch 4 - Head Terms
commercial power washing prices	50	Low			0%	T	Industrial	Batch 4 - Head Terms
precision power washing near me	50	Low			∞	T/L	Pressure Washing	Batch 4 - Head Terms
windows cleaning company near me	50	Unknown			0%	T/L	Window Cleaning	Batch 4 - Head Terms
cleaning windows services near me	50	Unknown			0%	T/L	Window Cleaning	Batch 4 - Head Terms
best heavy duty pressure washer	50	Unknown			0%	I	Pressure Washing	Batch 4 - Head Terms
exterior house power washing near me	50	Unknown			-100%	T/L	Pressure Washing	Batch 4 - Head Terms
mobile fleet wash near me	50	Unknown			0%	T/L	Fleet Washing	Batch 4 - Head Terms
soft wash pressure washing near me	50	Unknown			0%	T/L	Pressure Washing	Batch 4 - Head Terms
house siding cleaning companies near me	50	Unknown			0%	T/L		Batch 4 - Head Terms
window and power washing near me	50	Unknown			0%	T/L	Pressure Washing	Batch 4 - Head Terms
tile roof cleaning companies near me	50	Unknown			0%	T/L	Roof Cleaning	Batch 4 - Head Terms
crystal clear window cleaning near me	50	Unknown			0%	T/L	Window Cleaning	Batch 4 - Head Terms
cost of window cleaning near me	50	Unknown			0%	C	Window Cleaning	Batch 4 - Head Terms
glass cleaner near me	50	Medium			0%	T/L	Window Cleaning	Batch 4 - Head Terms
local house washing	50	Unknown			0%	T	Soft Washing	Batch 4 - Head Terms
best window cleaners in my area	50	Unknown			0%	I	Window Cleaning	Batch 4 - Head Terms
best window cleaning service near me	50	High			∞	T/L	Window Cleaning	Batch 4 - Head Terms
local pressure washing companies near me	50	Low			∞	T/L	Pressure Washing	Batch 4 - Head Terms
post renovation cleaning near me	50	Unknown			0%	T/L		Batch 4 - Head Terms
power washing costs near me	50	Unknown			0%	C	Pressure Washing	Batch 4 - Head Terms
companies that power wash homes near me	50	Unknown			0%	T/L	Pressure Washing	Batch 4 - Head Terms
downspout cleaning service near me	50	Unknown			0%	T/L		Batch 4 - Head Terms
local roof cleaning companies	50	Unknown			0%	T	Roof Cleaning	Batch 4 - Head Terms
parking lot maintenance companies near me	50	Unknown			0%	T/L	Parking Lot Services	Batch 4 - Head Terms
driveway cleaning company near me	50	Unknown			0%	T/L	Concrete Cleaning	Batch 4 - Head Terms
parking lot crack sealing	50	Low			∞	T	Parking Lot Services	Batch 4 - Head Terms
eco friendly power washing near me	50	Unknown			0%	T/L	Pressure Washing	Batch 4 - Head Terms
simpson commercial pressure washer	50	Medium			∞	T	Industrial	Batch 4 - Head Terms
best gutter cleaner near me	50	Unknown			0%	T/L	Gutter Services	Batch 4 - Head Terms
power wash cleaning services	50	Low			∞	T	Pressure Washing	Batch 4 - Head Terms
pressure washing and window cleaning near me	50	Unknown			0%	T/L	Pressure Washing	Batch 4 - Head Terms
low pressure house washing near me	50	Unknown			0%	T/L	Soft Washing	Batch 4 - Head Terms
power wash house companies near me	50	Unknown			0%	T/L	Pressure Washing	Batch 4 - Head Terms
commercial pressure washing service	50	Unknown			0%	T	Industrial	Batch 4 - Head Terms
power spraying near me	50	Unknown			0%	T/L		Batch 4 - Head Terms
commercial heated pressure washer	50	Unknown			-100%	T	Industrial	Batch 4 - Head Terms
tree trimming and gutter cleaning near me	50	Unknown			0%	T/L	Gutter Services	Batch 4 - Head Terms
pressurewashing near me	50	Unknown			0%	T/L		Batch 4 - Head Terms
best power washer for business	50	Unknown			0%	I	Pressure Washing	Batch 4 - Head Terms
parking lot seal coating near me	50	Unknown			0%	T/L	Parking Lot Services	Batch 4 - Head Terms
best house power washing near me	50	High			∞	T/L	Pressure Washing	Batch 4 - Head Terms
house pressure washing companies near me	50	Unknown			0%	T/L	Pressure Washing	Batch 4 - Head Terms
pressure washing costs near me	50	Unknown			0%	C	Pressure Washing	Batch 4 - Head Terms
industrial pressure washing services near me	50	Unknown			0%	T/L	Industrial	Batch 4 - Head Terms
power pressure washing near me	50	Unknown			0%	T/L	Pressure Washing	Batch 4 - Head Terms
pressure washing deals near me	50	Unknown			0%	T/L	Pressure Washing	Batch 4 - Head Terms
window cleaning and power washing near me	50	High			∞	T/L	Pressure Washing	Batch 4 - Head Terms
commercial window cleaning company near me	50	Unknown			0%	T/L	Window Cleaning	Batch 4 - Head Terms
post construction cleaning companies near me	50	Unknown			-100%	T/L	Construction Cleanup	Batch 4 - Head Terms
roof stain removal near me	50	Unknown			0%	T/L	Roof Cleaning	Batch 4 - Head Terms
gutters near me cleaning	50	Unknown			0%	T/L	Gutter Services	Batch 4 - Head Terms
indoor window cleaners near me	50	Medium			∞	T/L	Window Cleaning	Batch 4 - Head Terms
mobile fleet washing services near me	50	Unknown			-100%	T/L	Fleet Washing	Batch 4 - Head Terms
residential window washing services near me	50	Unknown			0%	T/L	Window Cleaning	Batch 4 - Head Terms
window cleaners residential near me	50	High			0%	T/L	Window Cleaning	Batch 4 - Head Terms
windows washer near me	50	Unknown			0%	T/L	Window Cleaning	Batch 4 - Head Terms
fence washing near me	50	Unknown			0%	T/L	Deck & Fence	Batch 4 - Head Terms
house pressure washer service near me	50	Unknown			-100%	T/L	Pressure Washing	Batch 4 - Head Terms
patio pressure washing service near me	50	Unknown			0%	T/L	Pressure Washing	Batch 4 - Head Terms
commercial exterior cleaning	50	Unknown			0%	T		Batch 4 - Head Terms
best power washing services near me	50	Unknown			0%	T/L	Pressure Washing	Batch 4 - Head Terms
skylight cleaning near me	50	Low			∞	T/L		Batch 4 - Head Terms
window & gutter cleaning near me	50	Unknown			0%	T/L	Gutter Services	Batch 4 - Head Terms
power wash cost house	50	Low	1.00	4.06	0%	T	Pressure Washing	Batch 4 - Head Terms
simpson professional pressure washer	50	Low			∞	T	Pressure Washing	Batch 4 - Head Terms
house siding power washing near me	50	Unknown			0%	T/L	Pressure Washing	Batch 4 - Head Terms
local window cleaning companies	50	Unknown			-100%	T	Window Cleaning	Batch 4 - Head Terms
good pressure washer for business	50	Unknown			0%	T	Pressure Washing	Batch 4 - Head Terms
siding power washing companies near me	50	Unknown			0%	T/L	Pressure Washing	Batch 4 - Head Terms
jet wash cleaners near me	50	Unknown			0%	T/L		Batch 4 - Head Terms
steam pressure washing services near me	50	Unknown			0%	T/L	Pressure Washing	Batch 4 - Head Terms
parking lot repair and striping	50	Unknown			0%	T	Parking Lot Services	Batch 4 - Head Terms
mobile pressure washing service near me	50	Unknown			0%	T/L	Pressure Washing	Batch 4 - Head Terms
window cleaning services in my area	50	Unknown			0%	T	Window Cleaning	Batch 4 - Head Terms
exterior power washing cost	50	Unknown			0%	T	Pressure Washing	Batch 4 - Head Terms
hotsy commercial pressure washer	50	Unknown			0%	T	Industrial	Batch 4 - Head Terms
pressure wash house cost near me	50	Unknown			0%	C	Pressure Washing	Batch 4 - Head Terms
local power washer	50	Low			0%	T	Pressure Washing	Batch 4 - Head Terms
top gutter cleaners near me	50	Unknown			0%	T/L	Gutter Services	Batch 4 - Head Terms
glass cleaner services near me	50	Unknown			0%	T/L	Window Cleaning	Batch 4 - Head Terms
soft wash cleaning near me	50	Unknown			0%	T/L	Soft Washing	Batch 4 - Head Terms
powerwashing services near me	50	Unknown			0%	T/L		Batch 4 - Head Terms
power wash house siding near me	50	Unknown			0%	T/L	Pressure Washing	Batch 4 - Head Terms
parking lot sealcoating and striping near me	50	Unknown			0%	T/L	Parking Lot Services	Batch 4 - Head Terms
commercial concrete cleaning services	50	Unknown			0%	T	Concrete Cleaning	Batch 4 - Head Terms
commercial pressure washing prices	50	Low			0%	T	Industrial	Batch 4 - Head Terms
hunter douglas blind cleaning near me	50	Unknown			0%	T/L		Batch 4 - Head Terms
outside window cleaners near me	50	Unknown			0%	T/L	Window Cleaning	Batch 4 - Head Terms
patio pressure washing near me	50	Unknown			0%	T/L	Pressure Washing	Batch 4 - Head Terms
roof cleaning near me cost	50	Unknown			0%	C	Roof Cleaning	Batch 4 - Head Terms
soft wash house near me	50	Unknown			0%	T/L	Soft Washing	Batch 4 - Head Terms
black owned power washing companies near me	50	Unknown			0%	T/L	Pressure Washing	Batch 4 - Head Terms
clear view window cleaning near me	50	Unknown			0%	T/L	Window Cleaning	Batch 4 - Head Terms
professional window cleaners in my area	50	Unknown			0%	T	Window Cleaning	Batch 4 - Head Terms
hot water power washing near me	50	Unknown			0%	T/L	Pressure Washing	Batch 4 - Head Terms
commercial parking lot sealcoating	50	Unknown			0%	T	Parking Lot Services	Batch 4 - Head Terms
power washing vinyl siding near me	50	Unknown			0%	T/L	Pressure Washing	Batch 4 - Head Terms
pressure washing rates near me	50	Unknown			0%	T/L	Pressure Washing	Batch 4 - Head Terms
hotsy pressure washer near me	50	Low			0%	T/L	Pressure Washing	Batch 4 - Head Terms
window and fascia cleaning near me	50	Unknown			0%	T/L	Window Cleaning	Batch 4 - Head Terms
kärcher professional pressure washer	50	High			0%	T	Pressure Washing	Batch 4 - Head Terms
asphalt parking lot sealcoating	50	High			0%	T	Parking Lot Services	Batch 4 - Head Terms
power cleaning services near me	50	Unknown			0%	T/L		Batch 4 - Head Terms
new construction cleaning near me	50	Unknown			0%	T/L	Construction Cleanup	Batch 4 - Head Terms
residential window cleaners in my area	50	Unknown			0%	T	Window Cleaning	Batch 4 - Head Terms
commercial power washing companies	50	Low			0%	T	Industrial	Batch 4 - Head Terms
4000 psi commercial pressure washer	50	High			∞	T	Industrial	Batch 4 - Head Terms
new construction house cleaning near me	50	Unknown			0%	T/L	Construction Cleanup	Batch 4 - Head Terms
mini blind cleaners near me	50	Unknown			0%	T/L		Batch 4 - Head Terms
high rise window washing companies near me	50	Unknown			0%	T/L	Window Cleaning	Batch 4 - Head Terms
house pressure washing in my area	50	Unknown			0%	T	Pressure Washing	Batch 4 - Head Terms
outdoor window cleaners near me	50	Unknown			0%	T/L	Window Cleaning	Batch 4 - Head Terms
outside window washers near me	50	Unknown			0%	T/L	Window Cleaning	Batch 4 - Head Terms
mobile pressure washing services near me	50	Unknown			0%	T/L	Pressure Washing	Batch 4 - Head Terms
window washing business near me	50	Unknown			0%	T/L	Window Cleaning	Batch 4 - Head Terms
average price of power washing a house	50	Low			∞	T	Pressure Washing	Batch 4 - Head Terms
residential window cleaning companies near me	50	High			∞	T/L	Window Cleaning	Batch 4 - Head Terms
professional electric power washer	50	Unknown			-100%	T	Pressure Washing	Batch 4 - Head Terms
soffit cleaners near me	50	Unknown			-100%	T/L		Batch 4 - Head Terms
commercial power washer electric	50	High	0.47	3.28	0%	T	Industrial	Batch 4 - Head Terms
best professional power washer	50	Unknown			0%	I	Pressure Washing	Batch 4 - Head Terms
