Keyword	Avg Monthly Volume	Competition	CPC Low	CPC High	YoY Change	Intent	Silo Assignment	Source Batch
best commercial electric power washer	50	High			∞	I	Industrial	Batch 4 - Head Terms
power washing window cleaning near me	50	Unknown			0%	T/L	Pressure Washing	Batch 4 - Head Terms
best window washing companies near me	50	Unknown			0%	T/L	Window Cleaning	Batch 4 - Head Terms
whole house power washing cost	50	Unknown			0%	T	Pressure Washing	Batch 4 - Head Terms
window cleaning and pressure washing near me	50	Unknown			0%	T/L	Pressure Washing	Batch 4 - Head Terms
business pressure washer	50	Medium	0.47	6.05	0%	T	Pressure Washing	Batch 4 - Head Terms
professional power washing company	50	Unknown			0%	T	Pressure Washing	Batch 4 - Head Terms
power cleaning near me	50	Unknown			0%	T/L		Batch 4 - Head Terms
road striping company near me	50	Unknown			0%	T/L	Parking Lot Services	Batch 4 - Head Terms
commercial driveway pressure washer	50	Unknown			-100%	T	Industrial	Batch 4 - Head Terms
best power washing companies	50	Unknown			-100%	I	Pressure Washing	Batch 4 - Head Terms
trailer mounted hot water commercial pressure washer	50	Unknown			0%	T	Industrial	Batch 4 - Head Terms
pressure washing near me cost	50	Unknown			0%	C	Pressure Washing	Batch 4 - Head Terms
best power washers for commercial use	50	Unknown			0%	I	Industrial	Batch 4 - Head Terms
outside window cleaning near me	50	Unknown			0%	T/L	Window Cleaning	Batch 4 - Head Terms
best power washer for commercial use	50	High			∞	I	Industrial	Batch 4 - Head Terms
electric power washer commercial	50	High	0.47	3.28	0%	T	Industrial	Batch 4 - Head Terms
window washing and gutter cleaning near me	50	Unknown			0%	T/L	Gutter Services	Batch 4 - Head Terms
outside house cleaning near me	50	Unknown			0%	T/L		Batch 4 - Head Terms
best pressure washing service near me	50	Medium			∞	T/L	Pressure Washing	Batch 4 - Head Terms
local window cleaning services	50	Unknown			0%	T	Window Cleaning	Batch 4 - Head Terms
softwash business	50	Unknown			0%	T		Batch 4 - Head Terms
parking area maintenance	50	Unknown			0%	T	Parking Lot Services	Batch 4 - Head Terms
industrial pressure washing services	50	Unknown			0%	T	Industrial	Batch 4 - Head Terms
construction clean up companies near me	50	Low			∞	T/L	Construction Cleanup	Batch 4 - Head Terms
window cleaning cost near me	50	Unknown			0%	C	Window Cleaning	Batch 4 - Head Terms
professional high pressure washer	50	Unknown			0%	T	Pressure Washing	Batch 4 - Head Terms
commercial window cleaner near me	50	Unknown			0%	T/L	Window Cleaning	Batch 4 - Head Terms
power washing rates near me	50	Unknown			0%	T/L	Pressure Washing	Batch 4 - Head Terms
gutter near me cleaning	50	Unknown			0%	T/L	Gutter Services	Batch 4 - Head Terms
power washing average cost	50	Low			∞	T	Pressure Washing	Batch 4 - Head Terms
top rated commercial pressure washers	50	High	0.57	1.90	0%	T	Industrial	Batch 4 - Head Terms
concrete power washing companies near me	50	Unknown			0%	T/L	Pressure Washing	Batch 4 - Head Terms
after construction cleaning near me	50	Unknown			0%	T/L	Construction Cleanup	Batch 4 - Head Terms
power wash driveway company	50	Medium			∞	T	Pressure Washing	Batch 4 - Head Terms
hot water pressure washer service near me	50	Unknown			0%	T/L	Pressure Washing	Batch 4 - Head Terms
power washing company prices	50	Unknown			0%	T	Pressure Washing	Batch 4 - Head Terms
pressure washing around me	50	Unknown			0%	T	Pressure Washing	Batch 4 - Head Terms
pressure washing prices per square foot commercial 2022	50	Unknown			0%	T	Industrial	Batch 4 - Head Terms
power washing deals near me	50	Unknown			0%	T/L	Pressure Washing	Batch 4 - Head Terms
top window cleaners near me	50	Unknown			0%	T/L	Window Cleaning	Batch 4 - Head Terms
high pressure washing services near me	50	Unknown			0%	T/L	Pressure Washing	Batch 4 - Head Terms
deck power washing services near me	50	Unknown			0%	T/L	Pressure Washing	Batch 4 - Head Terms
concrete parking lot crack repair	50	Unknown			0%	T	Concrete Cleaning	Batch 4 - Head Terms
commercial pressure washer sales near me	50	Unknown			0%	T/L	Industrial	Batch 4 - Head Terms
commercial cold water pressure washer	50	Unknown			0%	T	Industrial	Batch 4 - Head Terms
hot water pressure washer commercial	50	High			∞	T	Industrial	Batch 4 - Head Terms
commercial pressure washing cost	50	Low			0%	T	Industrial	Batch 4 - Head Terms
professional pressure washer company	50	Unknown			0%	T	Pressure Washing	Batch 4 - Head Terms
parking lot crack filling	50	Unknown			0%	T	Parking Lot Services	Batch 4 - Head Terms
roof cleaning prices near me	50	Unknown			0%	C	Roof Cleaning	Batch 4 - Head Terms
professional pressure washer trailer	50	Unknown			0%	T	Pressure Washing	Batch 4 - Head Terms
construction cleanup companies near me	50	Unknown			0%	T/L	Construction Cleanup	Batch 4 - Head Terms
pressure washer commercial use	50	Unknown			0%	T	Industrial	Batch 4 - Head Terms
construction site cleanup companies near me	50	Unknown			0%	T/L	Construction Cleanup	Batch 4 - Head Terms
the best commercial pressure washer	50	Unknown			0%	I	Industrial	Batch 4 - Head Terms
power washing house cost near me	50	High			∞	C	Pressure Washing	Batch 4 - Head Terms
commercial power washing business	50	Medium			∞	T	Industrial	Batch 4 - Head Terms
commercial duty pressure washer	50	Unknown			0%	T	Industrial	Batch 4 - Head Terms
local pressure cleaning	50	Low			0%	T	Pressure Washing	Batch 4 - Head Terms
power washer for business	50	Medium	0.47	6.05	0%	T	Pressure Washing	Batch 4 - Head Terms
best rated gutter cleaners near me	50	Unknown			0%	T/L	Gutter Services	Batch 4 - Head Terms
window cleaners nearby	50	High			∞	T	Window Cleaning	Batch 4 - Head Terms
residential window cleaning companies	50	Unknown			0%	T	Window Cleaning	Batch 4 - Head Terms
industrial pressure cleaning	50	Unknown			0%	T	Industrial	Batch 4 - Head Terms
best pressure washing services near me	50	Medium			∞	T/L	Pressure Washing	Batch 4 - Head Terms
soft wash render cleaning near me	50	Unknown			0%	T/L	Soft Washing	Batch 4 - Head Terms
driveway power washing companies	50	Medium			∞	T	Pressure Washing	Batch 4 - Head Terms
commercial pressure washing price per square foot	50	Unknown			0%	T	Industrial	Batch 4 - Head Terms
parking structure repair	50	Unknown			0%	T	Parking Lot Services	Batch 4 - Head Terms
commercial pressure washing business	50	Medium			∞	T	Industrial	Batch 4 - Head Terms
top power washing companies	50	Unknown			0%	T	Pressure Washing	Batch 4 - Head Terms
service pressure washer near me	50	Medium	3.17	7.25	0%	T/L	Pressure Washing	Batch 4 - Head Terms
commercial hot water power washer	50	Unknown			0%	T	Industrial	Batch 4 - Head Terms
residential power washing companies	50	Unknown			0%	T	Pressure Washing	Batch 4 - Head Terms
home window cleaner near me	50	Medium			∞	T/L	Window Cleaning	Batch 4 - Head Terms
sonic blind cleaning near me	50	Unknown			0%	T/L		Batch 4 - Head Terms
post construction cleanup near me	50	Unknown			0%	T/L	Construction Cleanup	Batch 4 - Head Terms
moss on roof removal near me	50	Unknown			0%	T/L	Roof Cleaning	Batch 4 - Head Terms
fleet clean near me	50	Unknown			0%	T/L	Fleet Washing	Batch 4 - Head Terms
best rated window cleaners near me	50	Unknown			0%	T/L	Window Cleaning	Batch 4 - Head Terms
honda pressure washer near me	50	Unknown			0%	T/L	Pressure Washing	Batch 4 - Head Terms
residential window washing companies	50	Unknown			0%	T	Window Cleaning	Batch 4 - Head Terms
parking lot asphalt crack sealing	50	Unknown			0%	T	Parking Lot Services	Batch 4 - Head Terms
hotsy pressure washers near me	50	Low			0%	T/L	Pressure Washing	Batch 4 - Head Terms
top commercial pressure washers	50	Unknown			0%	T	Industrial	Batch 4 - Head Terms
pressure washer place near me	50	Unknown			0%	T/L	Pressure Washing	Batch 4 - Head Terms
driveway power washing companies near me	50	Unknown			0%	T/L	Pressure Washing	Batch 4 - Head Terms
average cost for commercial pressure washing	50	Unknown			0%	T	Industrial	Batch 4 - Head Terms
best electric pressure washer for commercial use	50	Unknown			0%	I	Industrial	Batch 4 - Head Terms
professional pressure washer service	50	Low			0%	T	Pressure Washing	Batch 4 - Head Terms
parking lot maintenance inc	50	Unknown			0%	T	Parking Lot Services	Batch 4 - Head Terms
parking lot cleaning company	50	Medium			0%	T	Parking Lot Services	Batch 4 - Head Terms
commercial hot water pressure washer trailer	50	Unknown			0%	T	Industrial	Batch 4 - Head Terms
patriot power washing near me	50	Unknown			0%	T/L	Pressure Washing	Batch 4 - Head Terms
professional hot water pressure washer	50	Unknown			0%	T	Pressure Washing	Batch 4 - Head Terms
driveway pressure washing companies near me	50	Unknown			0%	T/L	Pressure Washing	Batch 4 - Head Terms
window and soffit cleaners near me	50	Unknown			0%	T/L	Window Cleaning	Batch 4 - Head Terms
high pressure washer near me	50	Unknown			0%	T/L	Pressure Washing	Batch 4 - Head Terms
power hosing near me	50	Medium			0%	T/L		Batch 4 - Head Terms
average price for power washing a house	50	Medium			0%	T	Pressure Washing	Batch 4 - Head Terms
power wash graffiti removal	50	Unknown			-100%	T	Pressure Washing	Batch 4 - Head Terms
commercial pressure cleaning services	50	Unknown			0%	T	Industrial	Batch 4 - Head Terms
parking lot repair and sealing	50	Unknown			0%	T	Parking Lot Services	Batch 4 - Head Terms
house window cleaning service near me	50	Unknown			0%	T/L	Window Cleaning	Batch 4 - Head Terms
parking lot repair services	50	Unknown			-100%	T	Parking Lot Services	Batch 4 - Head Terms
commercial concrete pressure washer	50	Unknown			0%	T	Industrial	Batch 4 - Head Terms
best heavy duty power washer	50	Unknown			0%	I	Pressure Washing	Batch 4 - Head Terms
good commercial pressure washer	50	High	0.57	1.90	0%	T	Industrial	Batch 4 - Head Terms
recommended window cleaners near me	50	Unknown			0%	T/L	Window Cleaning	Batch 4 - Head Terms
yelp window cleaning near me	50	Unknown			0%	T/L	Window Cleaning	Batch 4 - Head Terms
commercial parking lot maintenance	50	Unknown			0%	T	Parking Lot Services	Batch 4 - Head Terms
looking for window cleaner near me	50	Unknown			0%	T/L	Window Cleaning	Batch 4 - Head Terms
pressure washer in stock near me	50	High			∞	T/L	Pressure Washing	Batch 4 - Head Terms
best professional electric pressure washer	50	Unknown			0%	I	Pressure Washing	Batch 4 - Head Terms
commercial diesel pressure washer	50	Unknown			0%	T	Industrial	Batch 4 - Head Terms
residential construction cleaning services near me	50	Unknown			0%	T/L	Construction Cleanup	Batch 4 - Head Terms
small commercial pressure washer	50	Unknown			0%	T	Industrial	Batch 4 - Head Terms
mobile power washing company	50	Unknown			0%	T	Pressure Washing	Batch 4 - Head Terms
best rated window washers near me	50	Unknown			0%	T/L	Window Cleaning	Batch 4 - Head Terms
best pressure washer for professional use	50	Unknown			0%	I	Pressure Washing	Batch 4 - Head Terms
gutter zap near me	50	High			∞	T/L	Gutter Services	Batch 4 - Head Terms
professional driveway pressure washer	50	Unknown			0%	T	Pressure Washing	Batch 4 - Head Terms
best rated commercial pressure washer	50	High	0.57	1.90	0%	I	Industrial	Batch 4 - Head Terms
fleet truck wash near me	50	Unknown			0%	T/L	Fleet Washing	Batch 4 - Head Terms
top rated window cleaners near me	50	Low			∞	T/L	Window Cleaning	Batch 4 - Head Terms
industrial power washing services	50	Unknown			0%	T	Industrial	Batch 4 - Head Terms
price per square foot power washing	50	Low			0%	T	Pressure Washing	Batch 4 - Head Terms
cheap power washers near me	50	Unknown			0%	T/L	Pressure Washing	Batch 4 - Head Terms
asphalt parking lot crack repair	50	High			0%	T	Parking Lot Services	Batch 4 - Head Terms
local pressure wash	50	Low			0%	T	Pressure Washing	Batch 4 - Head Terms
window cleaners near my location	50	Unknown			0%	T	Window Cleaning	Batch 4 - Head Terms
sidewalk pressure washing near me	50	Unknown			0%	T/L	Pressure Washing	Batch 4 - Head Terms
heavy duty commercial pressure washer	50	Low			∞	T	Industrial	Batch 4 - Head Terms
simpson pressure washers near me	50	Unknown			0%	T/L	Pressure Washing	Batch 4 - Head Terms
fleet detailing near me	50	Unknown			0%	T/L	Fleet Washing	Batch 4 - Head Terms
commercial use pressure washer	50	Unknown			0%	T	Industrial	Batch 4 - Head Terms
power wash house exterior cost	50	Unknown			0%	T	Pressure Washing	Batch 4 - Head Terms
window and house cleaning near me	50	High			0%	T/L	Window Cleaning	Batch 4 - Head Terms
asphalt parking lot maintenance	50	Low			∞	T	Parking Lot Services	Batch 4 - Head Terms
4000 psi pressure washer near me	50	Unknown			0%	T/L	Pressure Washing	Batch 4 - Head Terms
commercial high pressure cleaning	50	Unknown			0%	T	Industrial	Batch 4 - Head Terms
commercial sidewalk cleaning	50	Unknown			0%	T		Batch 4 - Head Terms
washing company near me	50	Unknown			0%	T/L		Batch 4 - Head Terms
commercial powerwashers	50	Unknown			0%	T		Batch 4 - Head Terms
professional water pressure washer	50	Unknown			0%	T	Pressure Washing	Batch 4 - Head Terms
average price power wash house	50	Low			∞	T	Pressure Washing	Batch 4 - Head Terms
parking lot maintenance cost	50	Unknown			0%	T	Parking Lot Services	Batch 4 - Head Terms
building washing near me	50	Unknown			0%	T/L		Batch 4 - Head Terms
best power washing services	50	Unknown			0%	I	Pressure Washing	Batch 4 - Head Terms
portable commercial pressure washer	50	Unknown			0%	T	Industrial	Batch 4 - Head Terms
commercial pressure washer psi	50	Low			∞	T	Industrial	Batch 4 - Head Terms
house pressure washing cost near me	50	Unknown			0%	C	Pressure Washing	Batch 4 - Head Terms
commercial roof washing	50	Low			∞	T	Roof Cleaning	Batch 4 - Head Terms
mobile pressure washers near me	50	Unknown			0%	T/L	Pressure Washing	Batch 4 - Head Terms
best pressure washer professional	50	Unknown			0%	I	Pressure Washing	Batch 4 - Head Terms
sun joe pressure washer near me	50	Unknown			0%	T/L	Pressure Washing	Batch 4 - Head Terms
roof power washing company near me	50	Unknown			0%	T/L	Pressure Washing	Batch 4 - Head Terms
portable pressure washer near me	50	High			∞	T/L	Pressure Washing	Batch 4 - Head Terms
lot maintenance	50	Unknown			0%	T		Batch 4 - Head Terms
professional window washing near me	50	Low			∞	T/L	Window Cleaning	Batch 4 - Head Terms
average price to power wash house	50	Low			∞	T	Pressure Washing	Batch 4 - Head Terms
honda power washers near me	50	Unknown			0%	T/L	Pressure Washing	Batch 4 - Head Terms
storefront pressure washing	50	Unknown			0%	T	Pressure Washing	Batch 4 - Head Terms
house power washing contractors near me	50	Unknown			0%	T/L	Pressure Washing	Batch 4 - Head Terms
b & b window cleaning near me	50	Unknown			0%	T/L	Window Cleaning	Batch 4 - Head Terms
best pressure washer for business use	50	Unknown			0%	I	Pressure Washing	Batch 4 - Head Terms
clean pro gutter cleaning near me	50	Unknown			0%	T/L	Gutter Services	Batch 4 - Head Terms
commercial house wash	50	High			∞	T	Soft Washing	Batch 4 - Head Terms
commercial industrial pressure washer	50	Unknown			0%	T	Industrial	Batch 4 - Head Terms
commercial power washer with trailer	50	Unknown			0%	T	Industrial	Batch 4 - Head Terms
commercial power washing premier power cleaning	50	Unknown			0%	T	Industrial	Batch 4 - Head Terms
commercial pressure washer sales	50	High			0%	T	Industrial	Batch 4 - Head Terms
commercial pressure washing contractors	50	Low			0%	T	Industrial	Batch 4 - Head Terms
commercial pressure washing service near me	50	Unknown			0%	T/L	Industrial	Batch 4 - Head Terms
commercial soft washing	50	Unknown			0%	T	Soft Washing	Batch 4 - Head Terms
concrete parking lot maintenance	50	Unknown			0%	T	Concrete Cleaning	Batch 4 - Head Terms
deck cleaning company near me	50	Unknown			0%	T/L	Deck & Fence	Batch 4 - Head Terms
deck power washing companies near me	50	Unknown			0%	T/L	Pressure Washing	Batch 4 - Head Terms
deck wash commercial	50	Unknown			0%	T	Deck & Fence	Batch 4 - Head Terms
dumpster pad cleaning business	50	Unknown			0%	T		Batch 4 - Head Terms
dumpster pad pressure washing	50	Unknown			0%	T	Pressure Washing	Batch 4 - Head Terms
dumpster pad washing	50	Unknown			0%	T		Batch 4 - Head Terms
empire parking area maintenance and construction	50	Low			∞	T	Construction Cleanup	Batch 4 - Head Terms
fence power washing companies near me	50	High			∞	T/L	Pressure Washing	Batch 4 - Head Terms
gutter cleaners near me clean pro gutter cleaning	50	Unknown			0%	T/L	Gutter Services	Batch 4 - Head Terms
heavy duty hot water pressure washer	50	Low			∞	T	Pressure Washing	Batch 4 - Head Terms
high pressure washer professional	50	Unknown			0%	T	Pressure Washing	Batch 4 - Head Terms
home depot near me pressure washer	50	Unknown			0%	T/L	Pressure Washing	Batch 4 - Head Terms
honda power washer near me	50	Unknown			0%	T/L	Pressure Washing	Batch 4 - Head Terms
honda pressure washers near me	50	Unknown			0%	T/L	Pressure Washing	Batch 4 - Head Terms
kärcher commercial pressure washer	50	Low			0%	T	Industrial	Batch 4 - Head Terms
maintenance parking	50	Unknown			0%	T	Parking Lot Services	Batch 4 - Head Terms
parking area maintenance inc	50	Unknown			0%	T	Parking Lot Services	Batch 4 - Head Terms
parking lot crack sealing near me	50	Unknown			0%	T/L	Parking Lot Services	Batch 4 - Head Terms
parking lot sealcoating companies near me	50	Unknown			0%	T/L	Parking Lot Services	Batch 4 - Head Terms
pressure washers at home depot near me	50	Unknown			0%	T/L	Pressure Washing	Batch 4 - Head Terms
pressure washing service prices near me	50	Unknown			0%	C	Pressure Washing	Batch 4 - Head Terms
pricing commercial pressure washing	50	Unknown			0%	T	Industrial	Batch 4 - Head Terms
professional power washing cost	50	Unknown			0%	T	Pressure Washing	Batch 4 - Head Terms
residential and commercial pressure washing	50	Unknown			0%	T	Industrial	Batch 4 - Head Terms
residential pressure washing companies	50	Unknown			0%	T	Pressure Washing	Batch 4 - Head Terms
residential pressure washing companies near me	50	High			∞	T/L	Pressure Washing	Batch 4 - Head Terms
roof cleaners nearby	50	Unknown			0%	T	Roof Cleaning	Batch 4 - Head Terms
roof power washing companies near me	50	Unknown			0%	T/L	Pressure Washing	Batch 4 - Head Terms
roof washing around me	50	Unknown			0%	T	Roof Cleaning	Batch 4 - Head Terms
rosenberg commercial pressure washing near me	50	Unknown			0%	T/L	Industrial	Batch 4 - Head Terms
simpson power washer near me	50	Unknown			0%	T/L	Pressure Washing	Batch 4 - Head Terms
simpson power washers near me	50	Unknown			0%	T/L	Pressure Washing	Batch 4 - Head Terms
window cleaning around me	50	Unknown			0%	T	Window Cleaning	Batch 4 - Head Terms
roof cleaning conway ar	0	Unknown			--	T/L	Roof Cleaning	Batch 1 - Conway
concrete cleaning conway ar	0	Unknown			--	T/L	Concrete Cleaning	Batch 1 - Conway
deck cleaning conway ar	0	Unknown			--	T/L	Deck & Fence	Batch 1 - Conway
fleet washing conway ar	0	Unknown			--	T/L	Fleet Washing	Batch 1 - Conway
holiday lighting conway ar	0	Unknown			--	T/L	Holiday Lighting	Batch 1 - Conway
construction cleanup conway ar	0	Unknown			--	T/L	Construction Cleanup	Batch 1 - Conway
fleet washing little rock ar	0	Unknown			--	T/L	Fleet Washing	Batch 2 - Little Rock
parking lot cleaning little rock ar	0	Unknown			--	T/L	Parking Lot Services	Batch 2 - Little Rock
commercial pressure washing little rock ar	0	Unknown			--	T/L	Industrial	Batch 2 - Little Rock
apartment dryer duct cleaning	0	Unknown			--	T	Air Duct Cleaning	Batch 3 - New Commercial
permanent outdoor festoon lights	0	Unknown			0%	T	Permanent Lighting	Batch 3 - New Commercial
commercial dryer vent cleaning companies	0	Unknown			0%	T	Dryer Vent Cleaning	Batch 3 - New Commercial
govee rgbic led permanent outdoor lights h705a	0	Unknown			--	N	Permanent Lighting	Batch 3 - New Commercial
permanent outdoor holiday lights govee	0	Unknown			--	N	Holiday Lighting	Batch 3 - New Commercial
amazing govee permanent outdoor lights	0	Unknown			--	N	Permanent Lighting	Batch 3 - New Commercial
amazon com govee permanent outdoor lights	0	Unknown			--	N	Permanent Lighting	Batch 3 - New Commercial
apartment dryer lint trap	0	Unknown			--	T		Batch 3 - New Commercial
commercial dryer exhaust vent	0	Unknown			--	T		Batch 3 - New Commercial
commercial dryer vent cleaning danville	0	Unknown			--	T	Dryer Vent Cleaning	Batch 3 - New Commercial
gobe permanent outdoor lights	0	Unknown			--	T	Permanent Lighting	Batch 3 - New Commercial
govee h705a1d1	0	Unknown			--	N		Batch 3 - New Commercial
govee holiday permanent outdoor lights	0	Unknown			--	N	Holiday Lighting	Batch 3 - New Commercial
govee rgbic h705a	0	Unknown			--	N		Batch 3 - New Commercial
govee rgbic led permanent outdoor lights ebay	0	Unknown			--	N	Permanent Lighting	Batch 3 - New Commercial
govee rgbic led permanent outdoor lights review	0	Unknown			--	I	Permanent Lighting	Batch 3 - New Commercial
new govee smart rgbic permanent outdoor lights model h705a1d1 100ft	0	Unknown			--	N	Permanent Lighting	Batch 3 - New Commercial
permanent holiday lights govee	0	Unknown			--	N	Holiday Lighting	Batch 3 - New Commercial
permanent holiday lights outdoor	0	Unknown			--	T	Holiday Lighting	Batch 3 - New Commercial
permanent outdoor lights by govi	0	Unknown			--	T	Permanent Lighting	Batch 3 - New Commercial
permanent outdoor lights go beach	0	Unknown			--	T	Permanent Lighting	Batch 3 - New Commercial
parking lot striping arkansas	0	Unknown			--	T/L	Parking Lot Services	Batch 3 - New Commercial
sealcoating arkansas	0	Unknown			--	T/L	Parking Lot Services	Batch 3 - New Commercial
paver sealing arkansas	0	Unknown			--	T/L	Paver Cleaning	Batch 3 - New Commercial
air duct cleaning arkansas	0	Unknown			--	T/L	Air Duct Cleaning	Batch 3 - New Commercial
industrial pressure washing arkansas	0	Unknown			--	T/L	Industrial	Batch 3 - New Commercial
hot water pressure washing commercial	0	Unknown			--	T	Industrial	Batch 3 - New Commercial
domestic window cleaners near me	0	Unknown			0%	T/L	Window Cleaning	Batch 4 - Head Terms
jet washing services near me	0	Unknown			--	T/L		Batch 4 - Head Terms
eaves cleaning near me	0	Unknown			0%	T/L		Batch 4 - Head Terms
need gutters cleaned near me	0	Unknown			--	T/L	Gutter Services	Batch 4 - Head Terms
high pressure cleaning services near me	0	Unknown			--	T/L	Pressure Washing	Batch 4 - Head Terms
black owned gutter cleaning near me	0	Unknown			0%	T/L	Gutter Services	Batch 4 - Head Terms
perfect power wash near me	0	Unknown			--	T/L	Pressure Washing	Batch 4 - Head Terms
moss cleaning roof near me	0	Unknown			--	T/L	Roof Cleaning	Batch 4 - Head Terms
spouting cleaning near me	0	Unknown			0%	T/L		Batch 4 - Head Terms
jet wash services near me	0	Unknown			0%	T/L		Batch 4 - Head Terms
ned stevens gutter cleaning near me	0	Unknown			0%	T/L	Gutter Services	Batch 4 - Head Terms
emergency gutter cleaning near me	0	Unknown			0%	T/L	Gutter Services	Batch 4 - Head Terms
patio jet wash near me	0	Unknown			--	T/L		Batch 4 - Head Terms
gutter and downpipe cleaning near me	0	Unknown			0%	T/L	Gutter Services	Batch 4 - Head Terms
patio jet wash service near me	0	Unknown			--	T/L		Batch 4 - Head Terms
roof cleaning moss removal near me	0	Unknown			--	T/L	Roof Cleaning	Batch 4 - Head Terms
drone roof cleaning near me	0	Unknown			--	T/L	Roof Cleaning	Batch 4 - Head Terms
no pressure roof cleaning near me	0	Unknown			0%	T/L	Roof Cleaning	Batch 4 - Head Terms
after builders cleaning near me	0	Unknown			--	T/L		Batch 4 - Head Terms
colorbond roof cleaning near me	0	Unknown			--	T/L	Roof Cleaning	Batch 4 - Head Terms
jet wash service near me	0	Unknown			--	T/L		Batch 4 - Head Terms
sidewalk power washing near me	0	Unknown			0%	T/L	Pressure Washing	Batch 4 - Head Terms
ned stevens near me	0	Unknown			0%	T/L		Batch 4 - Head Terms
best roof cleaning company near me	0	Unknown			0%	T/L	Roof Cleaning	Batch 4 - Head Terms
professional gutter cleaning near me	0	Unknown			0%	T/L	Gutter Services	Batch 4 - Head Terms
gutter cleaning around me	0	Unknown			--	T	Gutter Services	Batch 4 - Head Terms
house pressure cleaning near me	0	Unknown			--	T/L	Pressure Washing	Batch 4 - Head Terms
whole house power washing near me	0	Unknown			--	T/L	Pressure Washing	Batch 4 - Head Terms
concrete power washing services near me	0	Unknown			0%	T/L	Pressure Washing	Batch 4 - Head Terms
spout cleaning near me	0	Unknown			--	T/L		Batch 4 - Head Terms
roman blind cleaning near me	0	Unknown			--	T/L		Batch 4 - Head Terms
gutter unblocking near me	0	Unknown			--	T/L	Gutter Services	Batch 4 - Head Terms
roof and window cleaning near me	0	Unknown			--	T/L	Roof Cleaning	Batch 4 - Head Terms
professional jet washer	0	Unknown			--	T		Batch 4 - Head Terms
jim's gutter cleaning near me	0	Unknown			--	T/L	Gutter Services	Batch 4 - Head Terms
pressure cleaning roof near me	0	Unknown			--	T/L	Pressure Washing	Batch 4 - Head Terms
driveway jet wash near me	0	Unknown			--	T/L	Concrete Cleaning	Batch 4 - Head Terms
industrial gutter cleaning near me	0	Unknown			0%	T/L	Gutter Services	Batch 4 - Head Terms
cladding cleaning near me	0	Unknown			--	T/L		Batch 4 - Head Terms
apartment window cleaning near me	0	Unknown			--	T/L	Window Cleaning	Batch 4 - Head Terms
find a window cleaner near me	0	Unknown			--	T/L	Window Cleaning	Batch 4 - Head Terms
ned's gutter cleaning near me	0	Unknown			--	T/L	Gutter Services	Batch 4 - Head Terms
jet wash driveway near me	0	Unknown			--	T/L	Concrete Cleaning	Batch 4 - Head Terms
pressure cleaning driveway near me	0	Unknown			--	T/L	Pressure Washing	Batch 4 - Head Terms
clean gutters in my area	0	Unknown			--	T	Gutter Services	Batch 4 - Head Terms
roof care near me	0	Unknown			--	T/L	Roof Cleaning	Batch 4 - Head Terms
garden jet wash service near me	0	Unknown			--	T/L		Batch 4 - Head Terms
